{
  "id": "new-experiment-id",
  "title": "New experiment title",
  "hypothesis": "If we do X, we expect Y to improve.",
  "owner": "Person Name",
  "team": "team-id",
  "risks": ["feasibility"],
  "dimensions": ["experiment-velocity"],
  "reviewDate": "2026-09-30",
  "status": "active",
  "changeSummary": "What changed or what you expect to change.",
  "linkedTools": [],
  "linkedPlays": [],
  "linkedScorecards": []
}
